<?xml version="1.0" encoding="UTF-8"?>
<simpsons xmlns:xsi="http://www.w3.org/2001/XMLSchema-instance" xsi:noNamespaceSchemaLocation="LosSimpsons.xsd">
	
	<localidad valor="Springfield" aÃ±oFundacion="1800"/>
	
	<pelicula>Estreno el dia 15-03-2012 	
		<titulo>Los Simpsons la pelicula</titulo>
	
	</pelicula>
	
	<creador bso="Danny Elfman">Matt Groening</creador>
	
	<familia nombre="Simpsons">5</familia>
	
	<temporadas>
	
		<temporada01/>
		
	</temporadas>
	
	<personajes>
		<Hommer/>
		<Marge/>
		<Bart/>
		<Lisa/>
		<Maggie/>
	
	</personajes>
	
	<colorPersonajes principal="amarillo" rojo="120" verde="150" azul="700"/>
	
	<MontgomeryBurns dni="12345678A" matricula="0001ABC" mac="14:e3:a5:34:87:ef" color="rojo"/>
	
	<localidadRival>San_Francisco</localidadRival> 
	<localidadAmiga>San_Francsco</localidadAmiga>
	
	

</simpsons>	